{
  "eventId": "10000000-0000-4000-8000-000000000001",
  "eventType": "AssessmentCompleted",
  "schemaVersion": 1,
  "occurredAt": "2026-10-10T15:00:00Z",
  "correlationId": "20000000-0000-4000-8000-000000000001",
  "payload": {
    "userId": "30000000-0000-4000-8000-000000000001",
    "assessmentId": "40000000-0000-4000-8000-000000000001",
    "assessmentType": "EXERCISE",
    "submissionId": "50000000-0000-4000-8000-000000000001",
    "resultId": "60000000-0000-4000-8000-000000000001",
    "lessonId": "70000000-0000-4000-8000-000000000001",
    "courseId": "80000000-0000-4000-8000-000000000001",
    "levelIdAtStart": "90000000-0000-4000-8000-000000000001",
    "earnedPoints": 2,
    "maxPoints": 2,
    "completedAt": "2026-10-10T15:00:00Z"
  }
}
